{
  "work_package": "FND-001",
  "git_sha": "8642dc467938a47ca8aac76fc44fc1875446c88b",
  "captured_at": "2026-08-22T13:02:40.498Z",
  "environment": "win32-x64; http://127.0.0.1:31955",
  "measurements": [
    {
      "name": "auth-status",
      "method": "GET",
      "path": "/api/auth/status",
      "samples": 50,
      "warmup_samples": 5,
      "p50_ms": 0.716,
      "p95_ms": 1.225,
      "max_ms": 1.745,
      "rss_bytes": 61427712
    }
  ]
}
